{
  "$schema": "https://json-schema.org/draft/2020-12/schema",
  "$id": "https://lake.doneinfifty.com/schemas/v0/event.json",
  "title": "Lake event",
  "type": "object",
  "required": [
    "id",
    "kind",
    "at",
    "actor"
  ],
  "properties": {
    "id": {
      "type": "string"
    },
    "kind": {
      "enum": [
        "house.joined",
        "house.left",
        "agent.registered",
        "knock",
        "offer",
        "counter",
        "decision",
        "agreement.signed",
        "grant.issued",
        "grant.revoked",
        "approval.requested",
        "approval.answered",
        "approval.withdrawn",
        "payment.settled",
        "attack.blocked",
        "agent.quarantined",
        "guild.formed",
        "study.result",
        "compute.done",
        "record.moved",
        "intent.opened",
        "quote.made",
        "offer.accepted",
        "blueprint.published",
        "agent.message",
        "tally.update",
        "lake.status"
      ]
    },
    "at": {
      "type": "string",
      "format": "date-time"
    },
    "actor": {
      "type": "string"
    },
    "subject": {
      "type": "string"
    },
    "data": {
      "type": "object",
      "description": "Numbers and short labels only. Never record contents.",
      "additionalProperties": {
        "type": [
          "string",
          "number",
          "boolean"
        ]
      }
    }
  },
  "additionalProperties": false
}
